{
  "artifact_id": "urn:uuid:f1824e5e-bdc3-584b-a983-98335dbf1408",
  "candidate_key": "sha256:165eb4690398d0d678fcd9e3cfb137494876dc50c3c6fd84a90e3366bc700d15",
  "decision": {
    "reason": "Audit envelope only; per-subject derived ranges remain separate.",
    "review_status": "pending",
    "reviewer_id": null
  },
  "entry_id": "urn:uuid:048a1238-9915-5f2e-8619-c8ccbc580529",
  "id": "urn:uuid:3381a048-274f-5e5c-850b-b347553d8d16",
  "lifecycle": {
    "revision": 1,
    "status": "draft"
  },
  "locator": {
    "end": 4431,
    "kind": "byte-range",
    "start": 0
  },
  "node_id": null,
  "proposed_title": "火元素",
  "schema": "core.boundary-record@0.1.0",
  "status": "proposed"
}
