{
  "artifact_id": "urn:uuid:f1824e5e-bdc3-584b-a983-98335dbf1408",
  "candidate_key": "sha256:6e7b0b4d6299af227361c0e14855e4166fe9b84ef4c49e1c73390b315aedea4a",
  "decision": {
    "reason": "Audit envelope only; per-subject derived ranges remain separate.",
    "review_status": "pending",
    "reviewer_id": null
  },
  "entry_id": "urn:uuid:6b39e079-5444-5437-9a89-b9fa3ed06027",
  "id": "urn:uuid:287a08a9-3b09-5bfa-a33d-44093b92591d",
  "lifecycle": {
    "revision": 1,
    "status": "draft"
  },
  "locator": {
    "end": 4274,
    "kind": "byte-range",
    "start": 0
  },
  "node_id": null,
  "proposed_title": "魅魔",
  "schema": "core.boundary-record@0.1.0",
  "status": "proposed"
}
