{
  "artifact_id": "urn:uuid:f1824e5e-bdc3-584b-a983-98335dbf1408",
  "candidate_key": "sha256:af38f2867f82d1e88672f2a319258b2849b1079421049306e1b059331b963b1a",
  "decision": {
    "reason": "Audit envelope only; per-subject derived ranges remain separate.",
    "review_status": "pending",
    "reviewer_id": null
  },
  "entry_id": "urn:uuid:b1a26be8-f173-5e7c-a9e8-1253c0018d9d",
  "id": "urn:uuid:4221cdbf-b7b5-5c26-8c20-06b55a513318",
  "lifecycle": {
    "revision": 1,
    "status": "draft"
  },
  "locator": {
    "end": 4150,
    "kind": "byte-range",
    "start": 0
  },
  "node_id": null,
  "proposed_title": "幽魂",
  "schema": "core.boundary-record@0.1.0",
  "status": "proposed"
}
