{
  "artifact_id": "urn:uuid:f1824e5e-bdc3-584b-a983-98335dbf1408",
  "candidate_key": "sha256:5ff3791ed7468b11cdf9f4be68b7504440b6e1587e9a71a037c90dfd95bb9dff",
  "decision": {
    "reason": "Audit envelope only; per-subject derived ranges remain separate.",
    "review_status": "pending",
    "reviewer_id": null
  },
  "entry_id": "urn:uuid:110fe3cc-449c-5d30-9bc5-47198a153a06",
  "id": "urn:uuid:a84bfd4c-b39f-5866-92a7-e0614b64a994",
  "lifecycle": {
    "revision": 1,
    "status": "draft"
  },
  "locator": {
    "end": 41516,
    "kind": "byte-range",
    "start": 0
  },
  "node_id": null,
  "proposed_title": "其他术语",
  "schema": "core.boundary-record@0.1.0",
  "status": "proposed"
}
