{
  "artifact_id": "urn:uuid:f1824e5e-bdc3-584b-a983-98335dbf1408",
  "candidate_key": "sha256:e855219842fd268543a59a5c8d64d930fd0aa27084fad168ad5b94585244f529",
  "decision": {
    "reason": "Audit envelope only; per-subject derived ranges remain separate.",
    "review_status": "pending",
    "reviewer_id": null
  },
  "entry_id": "urn:uuid:89505d38-cbaf-5747-9798-96f1a0bf6718",
  "id": "urn:uuid:139c35fd-312c-58fe-9573-8f517372e612",
  "lifecycle": {
    "revision": 1,
    "status": "draft"
  },
  "locator": {
    "end": 7441,
    "kind": "byte-range",
    "start": 0
  },
  "node_id": null,
  "proposed_title": "状态",
  "schema": "core.boundary-record@0.1.0",
  "status": "proposed"
}
